{
  "schemaVersion": 1,
  "modelId": "cuenote-symbol-smoke",
  "modelVersion": "0.9.0-smoke.1",
  "modelStatus": "EXPERIMENTAL",
  "datasetId": "cuenote-fixture-omr",
  "datasetVersion": "phase9-smoke-1",
  "gitCommit": "ceca582",
  "evaluatedAt": "2026-07-13T00:00:00.000Z",
  "task": "SYMBOL_DETECTION",
  "split": "test",
  "overallMetrics": {
    "precision": 0.571429,
    "recall": 0.642857,
    "f1": 0.595238,
    "ap50": 0.595238,
    "meanIoU": 0.642857
  },
  "perClassMetrics": [
    {
      "classId": "notehead.filled",
      "precision": 1,
      "recall": 1,
      "f1": 1,
      "ap50": 1,
      "meanIoU": 1,
      "support": 6
    },
    {
      "classId": "notehead.hollow",
      "precision": 1,
      "recall": 1,
      "f1": 1,
      "ap50": 1,
      "meanIoU": 1,
      "support": 2
    },
    {
      "classId": "stem.up",
      "precision": 1,
      "recall": 1,
      "f1": 1,
      "ap50": 1,
      "meanIoU": 1,
      "support": 8
    },
    {
      "classId": "stem.down",
      "precision": 1,
      "recall": 1,
      "f1": 1,
      "ap50": 1,
      "meanIoU": 1,
      "support": 2
    },
    {
      "classId": "rest.whole",
      "precision": 0,
      "recall": 0,
      "f1": 0,
      "ap50": 0,
      "meanIoU": 0,
      "support": 0
    },
    {
      "classId": "rest.half",
      "precision": 0.5,
      "recall": 1,
      "f1": 0.666667,
      "ap50": 0.666667,
      "meanIoU": 1,
      "support": 1
    },
    {
      "classId": "rest.quarter",
      "precision": 1,
      "recall": 1,
      "f1": 1,
      "ap50": 1,
      "meanIoU": 1,
      "support": 2
    },
    {
      "classId": "rest.eighth",
      "precision": 0,
      "recall": 0,
      "f1": 0,
      "ap50": 0,
      "meanIoU": 0,
      "support": 1
    },
    {
      "classId": "accidental.sharp",
      "precision": 1,
      "recall": 1,
      "f1": 1,
      "ap50": 1,
      "meanIoU": 1,
      "support": 2
    },
    {
      "classId": "accidental.flat",
      "precision": 0.5,
      "recall": 1,
      "f1": 0.666667,
      "ap50": 0.666667,
      "meanIoU": 1,
      "support": 1
    },
    {
      "classId": "accidental.natural",
      "precision": 0,
      "recall": 0,
      "f1": 0,
      "ap50": 0,
      "meanIoU": 0,
      "support": 1
    },
    {
      "classId": "clef.treble",
      "precision": 1,
      "recall": 1,
      "f1": 1,
      "ap50": 1,
      "meanIoU": 1,
      "support": 2
    },
    {
      "classId": "clef.bass",
      "precision": 0,
      "recall": 0,
      "f1": 0,
      "ap50": 0,
      "meanIoU": 0,
      "support": 0
    },
    {
      "classId": "dot.augmentation",
      "precision": 0,
      "recall": 0,
      "f1": 0,
      "ap50": 0,
      "meanIoU": 0,
      "support": 2
    },
    {
      "classId": "tie",
      "precision": 0,
      "recall": 0,
      "f1": 0,
      "ap50": 0,
      "meanIoU": 0,
      "support": 2
    },
    {
      "classId": "navigation.segno",
      "precision": 0,
      "recall": 0,
      "f1": 0,
      "ap50": 0,
      "meanIoU": 0,
      "support": 2
    },
    {
      "classId": "navigation.coda",
      "precision": 0,
      "recall": 0,
      "f1": 0,
      "ap50": 0,
      "meanIoU": 0,
      "support": 0
    }
  ],
  "perQualityMetrics": {
    "CLEAN_SCAN": {
      "precision": 0.571429,
      "recall": 0.642857,
      "f1": 0.595238,
      "ap50": 0.595238,
      "meanIoU": 0.642857
    },
    "SYNTHETIC_ONLY": {
      "precision": 0.571429,
      "recall": 0.642857,
      "f1": 0.595238,
      "ap50": 0.595238,
      "meanIoU": 0.642857
    },
    "REAL_SCAN": "NOT_EVALUATED"
  },
  "confusionMatrix": [],
  "latency": {
    "nodeSmokeMs": 1,
    "browserMedianMs": 0,
    "notes": "Browser median is filled by E2E/runtime validation, not by Node smoke evaluation."
  },
  "modelSize": {
    "fp32Bytes": 561,
    "fp16Bytes": 0,
    "int8Bytes": 0,
    "notes": "Filled after ONNX export. Quantization is not run for constant smoke models."
  },
  "browserCompatibility": [
    {
      "browser": "Chromium Playwright",
      "provider": "WASM",
      "status": "PASS",
      "notes": "Phase 9 E2E loaded the actual ONNX model through the worker, decoded detections, rendered overlay, and verified offline cache reuse. WebGPU may be attempted first and fall back to WASM."
    },
    {
      "browser": "Chromium Playwright",
      "provider": "WEBGPU",
      "status": "NOT_RUN",
      "notes": "The automated test environment does not require WebGPU success; fallback reason is accepted when WebGPU is unavailable."
    }
  ],
  "knownFailures": [
    "synthetic_only_no_photo_scan_coverage",
    "constant_detector_not_robust_to_symbol_density",
    "no_product_checkpoint"
  ],
  "promotionRecommendation": "EXPERIMENTAL"
}
